{"$schema":"https://json-schema.org/draft/2020-12/schema","type":"object","required":["rationale","geometry","intent","feedback_request"],"properties":{"rationale":{"type":"string","description":"Your reasoning, written first: what the evidence shows, what you decided to change and why, and what result you expect. Your output label and notes summarise this."},"geometry":{"type":"object"},"intent":{"type":"string"},"feedback_request":{"type":"object"},"learning":{"type":"string"}},"additionalProperties":false}