{
  "feedback_request": {
    "measurements": [
      "completion",
      "progress",
      "completion_time",
      "rms_error",
      "max_error",
      "line_loss_events",
      "steering_oscillation",
      "control_effort",
      "noise_robustness"
    ],
    "questions": [
      "Does s-bend line_loss_events fall below 0.9 from the 0.95 of iteration 5, with max_error still at or below 0.06 m?",
      "Does the oval finish hold at 0.95 or above, and does steering_oscillation stay near 0.23 to 0.30?",
      "Does the total score beat 465.8? If it does, is the gain from fewer s-bend line losses or from more completions?",
      "Does the larger footprint produce any signal flattening at the outer sensors, visible as higher oscillation on the s-bend?"
    ]
  },
  "geometry": {
    "body_length": 0.18,
    "body_width": 0.12,
    "mass": 0.6,
    "sensor_positions": [
      {
        "x": -0.04,
        "y": 0.06
      },
      {
        "x": -0.02,
        "y": 0.06
      },
      {
        "x": 0.0,
        "y": 0.06
      },
      {
        "x": 0.02,
        "y": 0.06
      },
      {
        "x": 0.04,
        "y": 0.06
      }
    ],
    "sensor_size": 0.016,
    "wheel_radius": 0.03,
    "wheel_track": 0.095
  },
  "intent": "Revert to the iteration 5 row (best score, 465.8: five sensors at x = \u00b10.04 m, y = 0.06 m, wheel_track 0.095 m, mass 0.6 kg) and change one thing only: sensor footprint from 12 mm to 16 mm. Expected result: s-bend line loss below 0.9 per run, s-bend max_error at or below 0.06 m, oval finish at or above 0.9, and a total score at or above 465.8. The Integrator keeps kp, ki, kd and base_speed under their own control; I would expect kp near 3.5 and kd 0.6 to carry over unchanged.",
  "learning": "Iteration 5 is the best geometry so far and the s-bend failure is line loss at the outer sensors, not lookahead. Footprint size is a cheap test of edge coverage that keeps the span and forward offset fixed. If it lowers line loss without hurting the oval, the next step is to keep 16 mm and test x = \u00b10.045 m at y = 0.06 m. If it does not help, the remaining lever is controller-side.",
  "rationale": "The best result so far is iteration 5 (score 465.8): five sensors at x = \u00b10.04 m, y = 0.06 m, wheel_track 0.095 m, mass 0.6 kg. Its oval finish was 0.95 and its s-bend max_error was 0.0591 m, under the 0.06 m off-track limit. Iterations 6, 7 and 8 each moved one lever away from that point and scored lower: widening to \u00b10.05 m cut s-bend line loss but dropped the oval to 0.90; y = 0.07 m pushed s-bend max_error back to 0.0626 m; and the interpolated row (y 0.065 m, \u00b10.045 m) gave s-bend max_error 0.0619 m with line loss 1.0 and score 432.4. I therefore return the geometry to the iteration 5 row. The one remaining failure there is s-bend line loss (0.95 per run, 16 of 20 trials off track) with max_error near the limit. Widening the span changed the oval and the forward offset, so I do not repeat that. Instead I change only the sensor footprint, from 12 mm to 16 mm. The sensor pitch stays at 0.02 m, so each footprint extends about 2 mm further across the line at the outer sensors, and the tape is seen at lateral offsets nearer the 0.06 m off-track limit. This is the lever the Robot Integrator's R1 feedback flagged for the case where s-bend line loss stays near 0.95 with max_error near 0.06 m, which is what iteration 5 shows. I expect s-bend line loss to fall without moving the oval or the forward offset, and the total score to match or beat 465.8. The risk is that a larger footprint softens the signal near the tape edge and adds oscillation, which the Integrator can absorb in the controller."
}
